{
  "contract": "turbojev.calibration-dataset.v1",
  "id": "fixture-overconfident-v1",
  "model_id": "fixture://calibration",
  "tokenizer_revision": "fixture-tokenizer-v1",
  "prompt_profile": "fixture-prompt-v1",
  "renderer_profile": "fixture-renderer-v1",
  "examples": [
    {"logits": [5.0, 0.0], "target": 0},
    {"logits": [5.0, 0.0], "target": 1},
    {"logits": [4.0, 0.0], "target": 0},
    {"logits": [4.0, 0.0], "target": 1},
    {"logits": [3.0, 0.0], "target": 0},
    {"logits": [3.0, 0.0], "target": 0},
    {"logits": [2.5, 0.0, -1.0], "target": 0, "weight": 2.0},
    {"logits": [2.5, 0.0, -1.0], "target": 1},
    {"logits": [1.2, 0.9, 0.2], "target": 1},
    {"logits": [1.2, 0.9, 0.2], "target": 0}
  ]
}
